{
  "schemaVersion": 1,
  "projectSlug": "zhuang-zhou-meng-die",
  "sceneId": "scene-04",
  "nodeId": "zhuang-awake",
  "poseFamilyId": "zhuang-awakening-states",
  "sourceAssetId": "zhuang-awakening-sheet",
  "input": "public/projects/zhuang-zhou-meng-die/assets/characters/source/zhuang-awakening-sheet.png",
  "outputDirectory": "public/projects/zhuang-zhou-meng-die/assets/characters",
  "registration": {"id": "zhuang-awakening-registration", "sourceMasterAssetId": "zhuang-awakening-master"},
  "layout": {"columns": 2, "rows": 2},
  "states": [
    {"id": "sleeping", "row": 0, "column": 0},
    {"id": "reclining-awake", "row": 0, "column": 1},
    {"id": "sitting-hands", "row": 1, "column": 0},
    {"id": "seated-questioning", "row": 1, "column": 1}
  ],
  "keying": {"keyColor": "#ff00ff", "matteErode": 2}
}
